{
  "schemaVersion": "2.0",
  "storage": "memory",
  "items": [
    {
      "id": "10000000-0000-4000-8000-000000000081",
      "name": "Fixture credential",
      "revision": 1,
      "versionId": "10000000-0000-4000-8000-000000000081",
      "editVersion": 1,
      "state": "ACTIVE",
      "createdAt": "2026-10-03T00:00:00Z",
      "updatedAt": "2026-10-03T00:00:00Z"
    }
  ],
  "truncated": false,
  "vaultAvailable": true,
  "canConfigure": true,
  "secretWriteAvailable": true
}
